{
  "$schema": "https://json-schema.org/draft/2020-12/schema",
  "$id": "https://github.com/ReptilianHQ/launch-on-block-sdk/indexing/manifest.schema.json",
  "title": "Launch On Block public indexing manifest",
  "type": "object",
  "required": [
    "$schema",
    "schemaVersion",
    "coverage",
    "abiRevision",
    "contracts",
    "networks"
  ],
  "properties": {
    "$schema": {
      "type": "string"
    },
    "schemaVersion": {
      "const": 1
    },
    "coverage": {
      "const": "public_integration_events"
    },
    "abiRevision": {
      "type": "string",
      "pattern": "^sha256:[0-9a-f]{64}$"
    },
    "materializations": {
      "type": "array",
      "minItems": 1,
      "items": {
        "type": "object",
        "required": [
          "name",
          "description",
          "key",
          "fields",
          "updates"
        ],
        "properties": {
          "name": {
            "type": "string"
          },
          "description": {
            "type": "string"
          },
          "key": {
            "const": "chainId:lowercase-address"
          },
          "fields": {
            "type": "object",
            "additionalProperties": {
              "type": "object",
              "required": [
                "type",
                "required"
              ],
              "properties": {
                "type": {
                  "enum": [
                    "String",
                    "BigInt"
                  ]
                },
                "required": {
                  "type": "boolean"
                }
              },
              "additionalProperties": false
            }
          },
          "updates": {
            "type": "array",
            "items": {
              "type": "object",
              "required": [
                "contract",
                "event",
                "keyParameter",
                "set"
              ],
              "properties": {
                "contract": {
                  "type": "string"
                },
                "event": {
                  "type": "string"
                },
                "keyParameter": {
                  "type": "string"
                },
                "set": {
                  "type": "object",
                  "additionalProperties": {
                    "oneOf": [
                      {
                        "type": "object",
                        "required": [
                          "parameter"
                        ],
                        "properties": {
                          "parameter": {
                            "type": "string"
                          }
                        },
                        "additionalProperties": false
                      },
                      {
                        "type": "object",
                        "required": [
                          "blockNumber"
                        ],
                        "properties": {
                          "blockNumber": {
                            "const": true
                          }
                        },
                        "additionalProperties": false
                      }
                    ]
                  }
                }
              },
              "additionalProperties": false
            }
          }
        },
        "additionalProperties": false
      }
    },
    "contracts": {
      "type": "array",
      "minItems": 1,
      "items": {
        "type": "object",
        "required": [
          "name",
          "abiFile",
          "sourceKind",
          "discoveredBy",
          "events"
        ],
        "properties": {
          "name": {
            "enum": [
              "Launchpad",
              "Router",
              "FeeController",
              "LaunchToken",
              "GraduationPool"
            ]
          },
          "abiFile": {
            "type": "string",
            "pattern": "^abis/[A-Za-z]+\\.events\\.json$"
          },
          "sourceKind": {
            "enum": [
              "fixed",
              "dynamic"
            ]
          },
          "discoveredBy": {
            "type": [
              "object",
              "null"
            ],
            "required": [
              "contract",
              "event",
              "addressParameter"
            ],
            "properties": {
              "contract": {
                "const": "Launchpad"
              },
              "event": {
                "enum": [
                  "LaunchCreated",
                  "Graduated"
                ]
              },
              "startFrom": {
                "const": "discovery-block"
              },
              "addressParameter": {
                "enum": [
                  "token",
                  "pool"
                ]
              }
            },
            "additionalProperties": false
          },
          "events": {
            "type": "array",
            "minItems": 1,
            "items": {
              "type": "object",
              "required": [
                "name",
                "signature",
                "topic0",
                "description",
                "parameters"
              ],
              "properties": {
                "name": {
                  "type": "string",
                  "minLength": 1
                },
                "signature": {
                  "type": "string",
                  "pattern": "^[A-Za-z][A-Za-z0-9_]*\\(.*\\)$"
                },
                "topic0": {
                  "type": "string",
                  "pattern": "^0x[0-9a-f]{64}$"
                },
                "description": {
                  "type": "string",
                  "minLength": 1
                },
                "parameters": {
                  "type": "array",
                  "items": {
                    "type": "object",
                    "required": [
                      "name",
                      "type",
                      "indexed",
                      "semantic"
                    ],
                    "properties": {
                      "name": {
                        "type": "string",
                        "minLength": 1
                      },
                      "type": {
                        "type": "string",
                        "minLength": 1
                      },
                      "indexed": {
                        "type": "boolean"
                      },
                      "semantic": {
                        "type": "string",
                        "minLength": 1
                      },
                      "asset": {
                        "type": "string",
                        "minLength": 1
                      },
                      "decimalsSource": {
                        "type": "string",
                        "minLength": 1
                      }
                    },
                    "additionalProperties": false
                  }
                }
              },
              "additionalProperties": false
            }
          }
        },
        "oneOf": [
          {
            "properties": {
              "name": {
                "enum": [
                  "Launchpad",
                  "Router",
                  "FeeController"
                ]
              },
              "sourceKind": {
                "const": "fixed"
              },
              "discoveredBy": {
                "type": "null"
              }
            }
          },
          {
            "properties": {
              "name": {
                "const": "LaunchToken"
              },
              "sourceKind": {
                "const": "dynamic"
              },
              "discoveredBy": {
                "type": "object",
                "required": [
                  "contract",
                  "event",
                  "addressParameter"
                ],
                "properties": {
                  "contract": {
                    "const": "Launchpad"
                  },
                  "event": {
                    "const": "LaunchCreated"
                  },
                  "addressParameter": {
                    "const": "token"
                  },
                  "startFrom": {
                    "const": "discovery-block"
                  }
                },
                "additionalProperties": false
              }
            }
          },
          {
            "properties": {
              "name": {
                "const": "GraduationPool"
              },
              "sourceKind": {
                "const": "dynamic"
              },
              "discoveredBy": {
                "type": "object",
                "required": [
                  "contract",
                  "event",
                  "addressParameter"
                ],
                "properties": {
                  "contract": {
                    "const": "Launchpad"
                  },
                  "event": {
                    "const": "Graduated"
                  },
                  "addressParameter": {
                    "const": "pool"
                  },
                  "startFrom": {
                    "const": "discovery-block"
                  }
                },
                "additionalProperties": false
              }
            }
          }
        ],
        "additionalProperties": false
      }
    },
    "networks": {
      "type": "array",
      "minItems": 1,
      "items": {
        "type": "object",
        "required": [
          "schemaVersion",
          "coverage",
          "caip2",
          "chainId",
          "network",
          "deploymentId",
          "releaseId",
          "abiRevision",
          "startBlock",
          "sources"
        ],
        "properties": {
          "schemaVersion": {
            "const": 1
          },
          "coverage": {
            "const": "public_integration_events"
          },
          "caip2": {
            "type": "string",
            "pattern": "^eip155:[1-9][0-9]*$"
          },
          "chainId": {
            "type": "integer",
            "minimum": 1
          },
          "network": {
            "type": "string",
            "minLength": 1
          },
          "deploymentId": {
            "type": "string",
            "minLength": 1
          },
          "releaseId": {
            "type": "string",
            "minLength": 1
          },
          "abiRevision": {
            "type": "string",
            "pattern": "^sha256:[0-9a-f]{64}$"
          },
          "startBlock": {
            "type": "integer",
            "minimum": 0
          },
          "sources": {
            "type": "array",
            "minItems": 1,
            "items": {
              "type": "object",
              "required": [
                "contract",
                "kind",
                "address",
                "startBlock",
                "discoveredBy"
              ],
              "properties": {
                "contract": {
                  "enum": [
                    "Launchpad",
                    "Router",
                    "FeeController",
                    "LaunchToken",
                    "GraduationPool"
                  ]
                },
                "kind": {
                  "enum": [
                    "fixed",
                    "dynamic"
                  ]
                },
                "address": {
                  "type": [
                    "string",
                    "null"
                  ],
                  "pattern": "^0x[0-9a-fA-F]{40}$"
                },
                "startBlock": {
                  "type": [
                    "integer",
                    "null"
                  ],
                  "minimum": 0
                },
                "discoveredBy": {
                  "type": [
                    "object",
                    "null"
                  ],
                  "required": [
                    "contract",
                    "event",
                    "addressParameter"
                  ],
                  "properties": {
                    "contract": {
                      "const": "Launchpad"
                    },
                    "event": {
                      "enum": [
                        "LaunchCreated",
                        "Graduated"
                      ]
                    },
                    "startFrom": {
                      "const": "discovery-block"
                    },
                    "addressParameter": {
                      "enum": [
                        "token",
                        "pool"
                      ]
                    }
                  },
                  "additionalProperties": false
                }
              },
              "oneOf": [
                {
                  "properties": {
                    "contract": {
                      "enum": [
                        "Launchpad",
                        "Router",
                        "FeeController"
                      ]
                    },
                    "kind": {
                      "const": "fixed"
                    },
                    "address": {
                      "type": "string",
                      "pattern": "^0x[0-9a-fA-F]{40}$"
                    },
                    "startBlock": {
                      "type": "integer",
                      "minimum": 0
                    },
                    "discoveredBy": {
                      "type": "null"
                    }
                  }
                },
                {
                  "properties": {
                    "contract": {
                      "const": "LaunchToken"
                    },
                    "kind": {
                      "const": "dynamic"
                    },
                    "address": {
                      "type": "null"
                    },
                    "startBlock": {
                      "type": "null"
                    },
                    "discoveredBy": {
                      "type": "object",
                      "required": [
                        "contract",
                        "event",
                        "addressParameter"
                      ],
                      "properties": {
                        "contract": {
                          "const": "Launchpad"
                        },
                        "event": {
                          "const": "LaunchCreated"
                        },
                        "addressParameter": {
                          "const": "token"
                        },
                        "startFrom": {
                          "const": "discovery-block"
                        }
                      },
                      "additionalProperties": false
                    }
                  }
                },
                {
                  "properties": {
                    "contract": {
                      "const": "GraduationPool"
                    },
                    "kind": {
                      "const": "dynamic"
                    },
                    "address": {
                      "type": "null"
                    },
                    "startBlock": {
                      "type": "null"
                    },
                    "discoveredBy": {
                      "type": "object",
                      "required": [
                        "contract",
                        "event",
                        "addressParameter"
                      ],
                      "properties": {
                        "contract": {
                          "const": "Launchpad"
                        },
                        "event": {
                          "const": "Graduated"
                        },
                        "addressParameter": {
                          "const": "pool"
                        },
                        "startFrom": {
                          "const": "discovery-block"
                        }
                      },
                      "additionalProperties": false
                    }
                  }
                }
              ],
              "additionalProperties": false
            }
          }
        },
        "additionalProperties": false
      }
    }
  },
  "additionalProperties": false
}
