{
  "$schema": "./manifest.schema.json",
  "schemaVersion": 1,
  "coverage": "public_integration_events",
  "abiRevision": "sha256:635cf660979631c57c4fa5cdf28460f8a4293272ebe153f0064e3758c6a5b9be",
  "contracts": [
    {
      "name": "Launchpad",
      "abiFile": "abis/Launchpad.events.json",
      "sourceKind": "fixed",
      "discoveredBy": null,
      "events": [
        {
          "name": "LaunchCreated",
          "signature": "LaunchCreated(address,address,uint16,uint16,address,string)",
          "topic0": "0xae76055728f8aa67cf9f5fb3080ad262991120b513b585fe5b4f1b211ea84321",
          "description": "A launch token and its creator payout terms were created.",
          "parameters": [
            {
              "name": "token",
              "type": "address",
              "indexed": true,
              "semantic": "address"
            },
            {
              "name": "creator",
              "type": "address",
              "indexed": true,
              "semantic": "address"
            },
            {
              "name": "creatorBps",
              "type": "uint16",
              "indexed": false,
              "semantic": "basis_points"
            },
            {
              "name": "curveFeeBps",
              "type": "uint16",
              "indexed": false,
              "semantic": "basis_points"
            },
            {
              "name": "payoutWallet",
              "type": "address",
              "indexed": false,
              "semantic": "address"
            },
            {
              "name": "metadataURI",
              "type": "string",
              "indexed": false,
              "semantic": "uri"
            }
          ]
        },
        {
          "name": "CurveAvailabilitySet",
          "signature": "CurveAvailabilitySet(uint32,bool)",
          "topic0": "0x57cfe4386279da1da40cdbaade7782f43734d07a64168a98d128d04461f3b20c",
          "description": "Availability of a registered curve for new launches changed.",
          "parameters": [
            {
              "name": "curveId",
              "type": "uint32",
              "indexed": true,
              "semantic": "integer"
            },
            {
              "name": "enabledForNewLaunches",
              "type": "bool",
              "indexed": false,
              "semantic": "boolean"
            }
          ]
        },
        {
          "name": "CurveRegistered",
          "signature": "CurveRegistered(uint32,address,bytes32)",
          "topic0": "0x937ac0525d2e3efe8f3d36d844189c3218f41ea62bdcacbb53964d0980d03abf",
          "description": "A curve implementation and reviewed code hash were registered.",
          "parameters": [
            {
              "name": "curveId",
              "type": "uint32",
              "indexed": true,
              "semantic": "integer"
            },
            {
              "name": "implementation",
              "type": "address",
              "indexed": true,
              "semantic": "address"
            },
            {
              "name": "codeHash",
              "type": "bytes32",
              "indexed": false,
              "semantic": "hash"
            }
          ]
        },
        {
          "name": "CurveSelected",
          "signature": "CurveSelected(address,uint32,address,uint256)",
          "topic0": "0x93d0ea63035b087d509c5205e9955afee7efa90be606c4750371bf020b992c8f",
          "description": "A launch token selected a curve implementation and quote target.",
          "parameters": [
            {
              "name": "token",
              "type": "address",
              "indexed": true,
              "semantic": "address"
            },
            {
              "name": "curveId",
              "type": "uint32",
              "indexed": true,
              "semantic": "integer"
            },
            {
              "name": "implementation",
              "type": "address",
              "indexed": true,
              "semantic": "address"
            },
            {
              "name": "quoteTarget",
              "type": "uint256",
              "indexed": false,
              "semantic": "raw_native_quote_amount",
              "asset": "chain native quote",
              "decimalsSource": "chain native currency decimals (18 on supported Robinhood chains)"
            }
          ]
        },
        {
          "name": "Buy",
          "signature": "Buy(address,address,uint256,uint256)",
          "topic0": "0x89f5adc174562e07c9c9b1cae7109bbecb21cf9d1b2847e550042b8653c54a0e",
          "description": "A buyer exchanged native quote value for launch tokens on the active curve.",
          "parameters": [
            {
              "name": "token",
              "type": "address",
              "indexed": true,
              "semantic": "address"
            },
            {
              "name": "buyer",
              "type": "address",
              "indexed": true,
              "semantic": "address"
            },
            {
              "name": "amountIn",
              "type": "uint256",
              "indexed": false,
              "semantic": "raw_native_quote_amount",
              "asset": "chain native quote",
              "decimalsSource": "chain native currency decimals (18 on supported Robinhood chains)"
            },
            {
              "name": "tokensOut",
              "type": "uint256",
              "indexed": false,
              "semantic": "raw_launch_token_amount",
              "asset": "event token parameter, or emitting LaunchToken",
              "decimalsSource": "token decimals() at the indexed block"
            }
          ]
        },
        {
          "name": "Sell",
          "signature": "Sell(address,address,uint256,uint256)",
          "topic0": "0xa082022e93cfcd9f1da5f9236718053910f7e840da080c789c7845698dc032ff",
          "description": "A seller exchanged launch tokens for native quote value on the active curve.",
          "parameters": [
            {
              "name": "token",
              "type": "address",
              "indexed": true,
              "semantic": "address"
            },
            {
              "name": "seller",
              "type": "address",
              "indexed": true,
              "semantic": "address"
            },
            {
              "name": "tokensIn",
              "type": "uint256",
              "indexed": false,
              "semantic": "raw_launch_token_amount",
              "asset": "event token parameter, or emitting LaunchToken",
              "decimalsSource": "token decimals() at the indexed block"
            },
            {
              "name": "amountOut",
              "type": "uint256",
              "indexed": false,
              "semantic": "raw_native_quote_amount",
              "asset": "chain native quote",
              "decimalsSource": "chain native currency decimals (18 on supported Robinhood chains)"
            }
          ]
        },
        {
          "name": "Graduated",
          "signature": "Graduated(address,address,uint256,uint256,uint256,uint256,uint256,uint256)",
          "topic0": "0xebd15c0efd3024e10b75dc0272a4893ec00a7a5adb4bf6668801c297a9f79c2c",
          "description": "A launch completed its curve and allocated assets into its graduation pool.",
          "parameters": [
            {
              "name": "token",
              "type": "address",
              "indexed": true,
              "semantic": "address"
            },
            {
              "name": "pool",
              "type": "address",
              "indexed": true,
              "semantic": "address"
            },
            {
              "name": "totalRaised",
              "type": "uint256",
              "indexed": false,
              "semantic": "raw_native_quote_amount",
              "asset": "chain native quote",
              "decimalsSource": "chain native currency decimals (18 on supported Robinhood chains)"
            },
            {
              "name": "creatorCut",
              "type": "uint256",
              "indexed": false,
              "semantic": "raw_native_quote_amount",
              "asset": "chain native quote",
              "decimalsSource": "chain native currency decimals (18 on supported Robinhood chains)"
            },
            {
              "name": "protocolCut",
              "type": "uint256",
              "indexed": false,
              "semantic": "raw_native_quote_amount",
              "asset": "chain native quote",
              "decimalsSource": "chain native currency decimals (18 on supported Robinhood chains)"
            },
            {
              "name": "poolQuote",
              "type": "uint256",
              "indexed": false,
              "semantic": "raw_native_quote_amount",
              "asset": "chain native quote",
              "decimalsSource": "chain native currency decimals (18 on supported Robinhood chains)"
            },
            {
              "name": "poolTokens",
              "type": "uint256",
              "indexed": false,
              "semantic": "raw_launch_token_amount",
              "asset": "event token parameter, or emitting LaunchToken",
              "decimalsSource": "token decimals() at the indexed block"
            },
            {
              "name": "burnedTokens",
              "type": "uint256",
              "indexed": false,
              "semantic": "raw_launch_token_amount",
              "asset": "event token parameter, or emitting LaunchToken",
              "decimalsSource": "token decimals() at the indexed block"
            }
          ]
        },
        {
          "name": "Claimed",
          "signature": "Claimed(address,uint256)",
          "topic0": "0xd8138f8a3f377c5259ca548e70e4c2de94f129f5a11036a15b69513cba2b426a",
          "description": "A pending native payout was claimed by its recipient.",
          "parameters": [
            {